{
  "id": "create_pricing_request",
  "version": "v1",
  "title": "Create a pricing request",
  "steps": [
    {
      "id": "summary",
      "title": "Summary",
      "description": "Capture the opportunity, technical pricing model, and corridor scope.",
      "approval_mode": "batch_at_submit",
      "fields": [
        {
          "id": "sending_partner_name",
          "label": "Sending Partner Name",
          "type": "string",
          "required": true,
          "validation": {
            "pattern": "^.{3,120}$"
          },
          "ui": {
            "placeholder": "e.g. Acme MEA expansion",
            "group": "Quoting Details"
          }
        },
        {
          "id": "opportunity_type",
          "label": "Opportunity type",
          "type": "enum",
          "required": true,
          "enum_options": [
            {
              "value": "New partner",
              "label": "New partner"
            },
            {
              "value": "Pricing Change",
              "label": "Pricing Change"
            },
            {
              "value": "Upsell",
              "label": "Upsell"
            }
          ],
          "ui": {
            "group": "Quoting Details"
          }
        },
        {
          "id": "use_cases",
          "label": "Use Cases",
          "type": "multi_enum",
          "required": true,
          "enum_options": [
            {
              "value": "Accept and Pay",
              "label": "Accept and Pay"
            },
            {
              "value": "Accept APM's",
              "label": "Accept APM's"
            },
            {
              "value": "Pay Business payments",
              "label": "Pay Business payments"
            },
            {
              "value": "Mass Payout",
              "label": "Mass Payout"
            },
            {
              "value": "Me2Me account top up",
              "label": "Me2Me account top up"
            },
            {
              "value": "Remittance",
              "label": "Remittance"
            },
            {
              "value": "Virtual account",
              "label": "Virtual account"
            },
            {
              "value": "Global Accounts",
              "label": "Global Accounts"
            },
            {
              "value": "QR code payments",
              "label": "QR code payments"
            },
            {
              "value": "Accept Business payments",
              "label": "Accept Business payments"
            },
            {
              "value": "Account Top-Up",
              "label": "Account Top-Up"
            },
            {
              "value": "Last Mile Payout",
              "label": "Last Mile Payout"
            },
            {
              "value": "Gambling account top up",
              "label": "Gambling account top up"
            },
            {
              "value": "Gambling account withdrawl",
              "label": "Gambling account withdrawl"
            },
            {
              "value": "Insurance payouts",
              "label": "Insurance payouts"
            },
            {
              "value": "Other",
              "label": "Other"
            }
          ],
          "ui": {
            "group": "Quoting Details"
          }
        },
        {
          "id": "opportunity_owner",
          "label": "Opportunity Owner",
          "type": "string",
          "required": false,
          "ui": {
            "placeholder": "Owner name or email",
            "group": "Quoting Details"
          }
        },
        {
          "id": "sending_partner_region",
          "label": "Sending Partner Region",
          "type": "enum",
          "required": true,
          "options_source": {
            "type": "priceframe_api",
            "endpoint": "/api/v1/corridors/active/filters",
            "value_path": "geographicalRegions",
            "label_path": "geographicalRegions",
            "cache_ttl_seconds": 300
          },
          "ui": {
            "group": "Quoting Details"
          }
        },
        {
          "id": "sending_partner_country",
          "label": "Sending Partner Country",
          "type": "enum",
          "required": true,
          "options_source": {
            "type": "priceframe_api",
            "endpoint": "/api/v1/corridors/active/filters",
            "value_path": "countries",
            "label_path": "countries",
            "depends_on": [
              "sending_partner_region"
            ],
            "cache_ttl_seconds": 300
          },
          "ui": {
            "group": "Quoting Details"
          }
        },
        {
          "id": "contract_length_years",
          "label": "Contract Length (years)",
          "type": "number",
          "required": true,
          "validation": {
            "min": 1,
            "max": 5,
            "decimals": 0
          },
          "ui": {
            "group": "Quoting Details"
          }
        },
        {
          "id": "waived_months",
          "label": "Waived Months (Commitment fee)",
          "type": "number",
          "required": true,
          "validation": {
            "min": 0,
            "max": 24,
            "decimals": 0
          },
          "ui": {
            "group": "Quoting Details"
          }
        },
        {
          "id": "pr_code",
          "label": "PR Code",
          "type": "string",
          "required": false,
          "ui": {
            "placeholder": "e.g. PR-2026-1131",
            "group": "Quoting Details"
          }
        },
        {
          "id": "show_fx_source_in_contract",
          "label": "Show FX Source in contract",
          "type": "enum",
          "required": true,
          "enum_options": [
            {
              "value": "YES",
              "label": "YES"
            },
            {
              "value": "NO",
              "label": "NO"
            }
          ],
          "ui": {
            "group": "Quoting Details"
          }
        },
        {
          "id": "show_fx_spread_in_contract",
          "label": "Show FX Spread in contract",
          "type": "enum",
          "required": true,
          "enum_options": [
            {
              "value": "YES",
              "label": "YES"
            },
            {
              "value": "NO",
              "label": "NO"
            }
          ],
          "ui": {
            "group": "Quoting Details"
          }
        },
        {
          "id": "integration_type",
          "label": "Integration Type",
          "type": "enum",
          "required": true,
          "enum_options": [
            {
              "value": "New API Integration",
              "label": "New API Integration"
            },
            {
              "value": "Transfers with Thunes Business Hub",
              "label": "Transfers with Thunes Business Hub"
            },
            {
              "value": "Middleware Integration",
              "label": "Middleware Integration"
            },
            {
              "value": "New Vertical & Corridor",
              "label": "New Vertical & Corridor"
            },
            {
              "value": "New Corridor",
              "label": "New Corridor"
            }
          ],
          "ui": {
            "group": "Technical Pricing Details"
          }
        },
        {
          "id": "fx_model",
          "label": "FX Model",
          "type": "enum",
          "required": true,
          "enum_options": [
            {
              "value": "Traditional FX",
              "label": "Traditional FX"
            },
            {
              "value": "Trading Desk",
              "label": "Trading Desk"
            },
            {
              "value": "Both Models",
              "label": "Both Models"
            }
          ],
          "ui": {
            "group": "Technical Pricing Details"
          }
        },
        {
          "id": "pricing_strategy",
          "label": "Pricing Strategy",
          "type": "enum",
          "required": true,
          "enum_options": [
            {
              "value": "Corridor Pricing",
              "label": "Corridor Pricing"
            }
          ],
          "ui": {
            "group": "Technical Pricing Details"
          }
        },
        {
          "id": "fx_pricing",
          "label": "FX Pricing",
          "type": "enum",
          "required": true,
          "enum_options": [
            {
              "value": "FX Spread",
              "label": "FX Spread"
            },
            {
              "value": "Revenue Share",
              "label": "Revenue Share"
            }
          ],
          "ui": {
            "group": "Technical Pricing Details"
          }
        },
        {
          "id": "quantity_funding_currencies",
          "label": "Quantity Funding Currencies",
          "type": "enum",
          "required": true,
          "enum_options": [
            {
              "value": "1",
              "label": "1"
            },
            {
              "value": "2",
              "label": "2"
            }
          ],
          "ui": {
            "group": "Technical Pricing Details"
          }
        },
        {
          "id": "funding_currencies",
          "label": "Funding Currency",
          "type": "multi_enum",
          "required": true,
          "enum_options": [
            {
              "value": "USD",
              "label": "USD"
            },
            {
              "value": "EUR",
              "label": "EUR"
            },
            {
              "value": "GBP",
              "label": "GBP"
            },
            {
              "value": "AUD",
              "label": "AUD"
            },
            {
              "value": "CAD",
              "label": "CAD"
            },
            {
              "value": "CNY",
              "label": "CNY"
            },